[
  {
    "id": "2026-10-15-backfill",
    "date": "2026-10-15",
    "kind": "backfill",
    "status": "ok",
    "x_reads": 4,
    "counts": {
      "candidates": 30,
      "published_updates": 17,
      "published_issues": 2,
      "dropped_verify": 10,
      "stripped_privacy": 4,
      "ci_failures": 0,
      "dropped_privacy": 1
    },
    "notes": [
      "Launch backfill of about 30 days of public posts from team accounts (Sep 15 to Oct 15).",
      "Verify dropped 10: six livestream promos and one case study (not product changes), one connector post from an account it couldn't identify, one bug reply with no context, and one duplicate fix reply.",
      "Privacy rewrote 4 entries so no regular user is named, and uses x.com/i/status links for non-team sources.",
      "Privacy dropped one entry because it centered on a person's email address."
    ]
  },
  {
    "id": "2026-10-16-daily",
    "date": "2026-10-16",
    "kind": "daily",
    "status": "ok",
    "x_reads": 5,
    "counts": {
      "posts_screened": 36,
      "candidates": 3,
      "published_updates": 0,
      "published_issues": 1,
      "dropped_verify": 2,
      "stripped_privacy": 1,
      "dropped_privacy": 0,
      "ci_failures": 0,
      "corrections_mail": 0
    },
    "notes": [
      "X search was rate limited (HTTP 429) on Grok Bot's shared X access, so the public bug-report search was skipped. Team timelines were read directly.",
      "All 25 @bot posts since the last run were replies handing tagged requests to people's own Grok Bots, not product changes.",
      "Verify dropped a conference workshop post (event, not a product change) and a pricing reply already covered by the unified plan entry.",
      "Re-checked the open lockout issue: no fix post yet, so it stays open. No corrections mail.",
      "Advisor opened a Scout rule PR because event and promo drops happened in two runs.",
      "Friday retro posted in Team chat."
    ],
    "pr": "https://github.com/slopryno/slopworks/pull/8"
  }
]
